{
  "schema_version": "1.0.0",
  "run_id": "demo-run",
  "attempt_id": "attempt-01",
  "seq": 0,
  "event_type": "capture-started",
  "invocation_id": null,
  "payload_sha256": "0000000000000000000000000000000000000000000000000000000000000000",
  "previous_event_sha256": null,
  "event_sha256": "0000000000000000000000000000000000000000000000000000000000000000",
  "timestamp": "2026-06-23T00:00:00Z",
  "timestamp_source": "local-clock",
  "origin": "local-observed"
}
